<routes xmlns="routes"
xmlns:xsi="http://www.w3.org/2001/XMLSchema-instance"
xsi:schemaLocation="routes validation/routes.xsd">
 <route name="test01" enabled="false">
    <!-- 192.168.16.145 -->
    <macAddr>dcd3211c9fdf</macAddr> 
 </route>
 <route name="test02" enabled="true">
    <!-- 192.168.19.119 -->
    <macAddr>0003784b7ab6</macAddr>
 </route>
 <route name="test03" enabled="false">
    <!-- 192.168.19.63 -->
    <macAddr>0003784b7aa4</macAddr>
 </route>
 <route name="test04" enabled="false">
    <!-- 192.168.16.170 -->
    <macAddr>dcd3211c9f08</macAddr>
 </route>
</routes>
